{
  "$schema": "config.schema.json",
  "code_review": "every_phase",
  "formal_approval": "every_phase",
  "documentation_update": "every_milestone",
  "review_strictness": "balanced",
  "re_review_trigger": "required",
  "status_updates": "pm_only",
  "workspace": {
    "primary_repo": {
      "name": "primary",
      "path": ".",
      "owns_plans": true
    },
    "shared_repos": []
  }
}
